{
  "adapterProtocolVersion": 1,
  "operationId": "11111111-1111-4111-8111-111111111111",
  "operation": "build-props",
  "recipeSchemaVersion": "magnates-remotion-recipe-v2",
  "workspace": "/project",
  "runDirectory": "/project/.editorial-runs/run-fixture-001",
  "target": {"profileId": "youtube-1080p", "width": 1920, "height": 1080, "fps": 30},
  "inputs": {
    "recipePayload": "/project/.editorial-runs/run-fixture-001/recipe/recipe.payload.json",
    "recipeLock": "/project/.editorial-runs/run-fixture-001/recipe/recipe.lock.json",
    "assetInventory": "/project/.editorial-runs/run-fixture-001/evidence/asset-inventory.json"
  },
  "outputs": {
    "props": "/project/.editorial-runs/run-fixture-001/adapter/build-props/op-001/remotion-props.json",
    "buildTelemetry": "/project/.editorial-runs/run-fixture-001/adapter/build-props/op-001/build-telemetry.json"
  },
  "expectedHashes": {
    "recipePayload": "aaaaaaaaaaaaaaaaaaaaaaaaaaaaaaaaaaaaaaaaaaaaaaaaaaaaaaaaaaaaaaaa",
    "recipeLock": "bbbbbbbbbbbbbbbbbbbbbbbbbbbbbbbbbbbbbbbbbbbbbbbbbbbbbbbbbbbbbbbb",
    "assetInventory": "cccccccccccccccccccccccccccccccccccccccccccccccccccccccccccccccc"
  },
  "deadline": "2026-07-22T12:00:00.000Z"
}
